{
  "schema_version": "2.0.0",
  "sidecar_type": "TASK_REGISTRY",
  "markdown_source": "project-runtime/TASK_REGISTRY.md",
  "state_revision": 1,
  "updated_at": "2026-01-01T00:00:00Z",
  "updated_by": "orchestrator",
  "content": {
    "registry_revision": 1,
    "tasks": [
      {
        "task_id": "TASK_DAG_ROOT",
        "task_title": "Root task",
        "task_type": "developer",
        "task_kind": "normal",
        "owner_role": "developer",
        "status": "completed",
        "task_packet": "project-runtime/tasks/active/TASK_DAG_ROOT.md",
        "dependencies": [],
        "requested_by_role": "NONE",
        "requested_by_task": "NONE",
        "return_to_requester_after_audit_pass": false,
        "return_to_role_after_audit_pass": "none",
        "return_task_after_audit_pass": "NONE",
        "research_question_id": "NONE",
        "result_refs": [],
        "audit_refs": ["project-runtime/audits/AUDIT_TASK_DAG_ROOT.md"],
        "correction_links": [],
        "commit_hash": "NONE",
        "branch": "NONE",
        "push_status": "not_required",
        "accepted_files": [],
        "checkpoint_ref": "NONE",
        "created_at": "2026-01-01T00:00:00Z",
        "updated_at": "2026-01-01T00:00:00Z"
      },
      {
        "task_id": "TASK_DAG_MIDDLE",
        "task_title": "Middle task",
        "task_type": "developer",
        "task_kind": "normal",
        "owner_role": "developer",
        "status": "audit_passed",
        "task_packet": "project-runtime/tasks/active/TASK_DAG_MIDDLE.md",
        "dependencies": ["TASK_DAG_ROOT"],
        "requested_by_role": "NONE",
        "requested_by_task": "NONE",
        "return_to_requester_after_audit_pass": false,
        "return_to_role_after_audit_pass": "none",
        "return_task_after_audit_pass": "NONE",
        "research_question_id": "NONE",
        "result_refs": [],
        "audit_refs": ["project-runtime/audits/AUDIT_TASK_DAG_MIDDLE.md"],
        "correction_links": [],
        "commit_hash": "NONE",
        "branch": "NONE",
        "push_status": "not_required",
        "accepted_files": [],
        "checkpoint_ref": "NONE",
        "created_at": "2026-01-01T00:00:00Z",
        "updated_at": "2026-01-01T00:00:00Z"
      },
      {
        "task_id": "TASK_DAG_LEAF",
        "task_title": "Leaf task",
        "task_type": "developer",
        "task_kind": "normal",
        "owner_role": "developer",
        "status": "ready",
        "task_packet": "project-runtime/tasks/active/TASK_DAG_LEAF.md",
        "dependencies": ["TASK_DAG_MIDDLE"],
        "requested_by_role": "developer",
        "requested_by_task": "TASK_DAG_MIDDLE",
        "return_to_requester_after_audit_pass": true,
        "return_to_role_after_audit_pass": "developer",
        "return_task_after_audit_pass": "TASK_DAG_MIDDLE",
        "research_question_id": "NONE",
        "result_refs": [],
        "audit_refs": [],
        "correction_links": [],
        "commit_hash": "NONE",
        "branch": "NONE",
        "push_status": "not_required",
        "accepted_files": [],
        "checkpoint_ref": "NONE",
        "created_at": "2026-01-01T00:00:00Z",
        "updated_at": "2026-01-01T00:00:00Z"
      }
    ]
  }
}
